{
  "$schema": "./schemas/pattern-catalog.schema.json",
  "schemaVersion": "1.0.0",
  "version": "0.4.0",
  "brandVersionId": "wonka-brand-v0.1.0",
  "patterns": [
    {
      "id": "pattern.system.brand-os",
      "name": "Brand OS overview",
      "description": "A system-level view that explains the canonical source, policy flow, machine interfaces, and trace contract.",
      "kind": "documentation",
      "status": "beta",
      "introducedIn": "0.3.0",
      "source": "src/design-system/stories/introduction.stories.tsx",
      "storyId": "getting-started-introduction--overview",
      "channelIds": [
        "channel.product",
        "channel.website",
        "channel.campaign",
        "channel.presentation"
      ],
      "requiredTokenSets": ["semantic.color", "typography", "radius"],
      "requiredComponentIds": ["component.badge"],
      "requiredAssetIds": [],
      "requiredRuleIds": [
        "rule.no-raw-color",
        "rule.contrast-aa",
        "rule.agent-traceability"
      ],
      "slots": [
        {
          "id": "system-status",
          "role": "evidence",
          "required": true,
          "instruction": "Show the exact design-system version, brand version, approval state, themes, and interface status."
        },
        {
          "id": "operating-model",
          "role": "sequence",
          "required": true,
          "instruction": "Explain the deterministic path from channel intent to policy, composition, and trace."
        },
        {
          "id": "machine-surface",
          "role": "interface",
          "required": true,
          "instruction": "Expose stable discovery and catalog endpoints without requiring rendered-page scraping."
        }
      ],
      "agent": {
        "requiredInputs": ["audience", "channel", "theme"],
        "requiredTraceFields": [
          "designSystemVersion",
          "brandVersionId",
          "channel",
          "theme",
          "policyStatus",
          "tokens",
          "components",
          "assets",
          "patterns",
          "unresolvedDecisions"
        ],
        "humanReviewTriggers": [
          "Changing approval state",
          "Presenting a beta contract as stable",
          "Publishing a new brand version"
        ]
      },
      "usage": {
        "do": [
          "Use this as the entry point for human and agent onboarding.",
          "Keep system status derived from generated contracts."
        ],
        "dont": [
          "Hard-code approval or inventory counts.",
          "Imply that review-required decisions are effective."
        ]
      }
    },
    {
      "id": "pattern.governance.agent-workbench",
      "name": "Agent policy workbench",
      "description": "An interactive governance surface for selecting a channel, inspecting readiness, and reviewing the trace an agent must return.",
      "kind": "governance",
      "status": "beta",
      "introducedIn": "0.3.0",
      "source": "src/design-system/stories/agent-workbench.stories.tsx",
      "storyId": "governance-agent-workbench--workbench",
      "channelIds": ["channel.product"],
      "requiredTokenSets": ["semantic.color", "typography", "radius", "motion"],
      "requiredComponentIds": [
        "component.badge",
        "component.button",
        "component.surface"
      ],
      "requiredAssetIds": [],
      "requiredRuleIds": [
        "rule.no-raw-color",
        "rule.contrast-aa",
        "rule.agent-traceability"
      ],
      "slots": [
        {
          "id": "channel-selector",
          "role": "control",
          "required": true,
          "instruction": "Offer every canonical channel and expose the stable channel ID."
        },
        {
          "id": "policy-result",
          "role": "evidence",
          "required": true,
          "instruction": "Separate effective, candidate, and blocked decisions."
        },
        {
          "id": "trace-preview",
          "role": "interface",
          "required": true,
          "instruction": "Preview machine-readable provenance for the selected channel."
        }
      ],
      "agent": {
        "requiredInputs": ["channel", "theme", "artifactIntent"],
        "requiredTraceFields": [
          "designSystemVersion",
          "brandVersionId",
          "channel",
          "theme",
          "policyStatus",
          "tokens",
          "components",
          "assets",
          "patterns",
          "unresolvedDecisions"
        ],
        "humanReviewTriggers": [
          "Any candidate or blocked dependency",
          "Any rights-verification-required asset",
          "Any requested policy exception"
        ]
      },
      "usage": {
        "do": [
          "Resolve policy before presenting a recommended composition.",
          "Keep channel selection keyboard operable."
        ],
        "dont": [
          "Merge candidate and effective decisions.",
          "Hide approval or rights blockers."
        ]
      }
    },
    {
      "id": "pattern.product.agent-workspace",
      "name": "Agent workspace",
      "description": "A task-oriented product shell that keeps agent activity, source context, approvals, and next actions legible.",
      "kind": "artifact",
      "status": "beta",
      "introducedIn": "0.3.0",
      "source": "src/design-system/stories/artifact-lab.stories.tsx",
      "storyId": "compositions-artifact-lab--studio",
      "channelIds": ["channel.product"],
      "requiredTokenSets": [
        "semantic.color",
        "component",
        "typography",
        "motion",
        "radius"
      ],
      "requiredComponentIds": [
        "component.badge",
        "component.button",
        "component.surface"
      ],
      "requiredAssetIds": [],
      "requiredRuleIds": [
        "rule.no-raw-color",
        "rule.contrast-aa",
        "rule.agent-traceability"
      ],
      "slots": [
        {
          "id": "task-context",
          "role": "content",
          "required": true,
          "instruction": "Name the user goal, connected sources, and current agent state."
        },
        {
          "id": "activity-trace",
          "role": "evidence",
          "required": true,
          "instruction": "Show consequential tool activity and the evidence used."
        },
        {
          "id": "approval-action",
          "role": "control",
          "required": true,
          "instruction": "Make the next human decision explicit and reversible."
        }
      ],
      "agent": {
        "requiredInputs": ["task", "sourceContext", "approvalBoundary"],
        "requiredTraceFields": [
          "designSystemVersion",
          "brandVersionId",
          "channel",
          "theme",
          "policyStatus",
          "tokens",
          "components",
          "assets",
          "patterns",
          "unresolvedDecisions",
          "sources",
          "actions",
          "approval"
        ],
        "humanReviewTriggers": [
          "External write or message",
          "Access-control change",
          "Irreversible action"
        ]
      },
      "usage": {
        "do": [
          "Keep the current task and system state visible together.",
          "Make pending approval distinct from progress."
        ],
        "dont": [
          "Use decorative activity that resembles real agent execution.",
          "Collapse evidence and final output into an ambiguous feed."
        ]
      }
    },
    {
      "id": "pattern.website.editorial-landing",
      "name": "Editorial landing",
      "description": "A conversion-oriented website composition pairing editorial authority with explicit product evidence.",
      "kind": "artifact",
      "status": "beta",
      "introducedIn": "0.3.0",
      "source": "src/design-system/stories/artifact-lab.stories.tsx",
      "storyId": "compositions-artifact-lab--studio",
      "channelIds": ["channel.website"],
      "requiredTokenSets": [
        "semantic.color",
        "component",
        "typography",
        "motion",
        "radius"
      ],
      "requiredComponentIds": [
        "component.button",
        "component.eyebrow",
        "component.section",
        "component.surface"
      ],
      "requiredAssetIds": ["asset.logo.wordmark"],
      "requiredRuleIds": [
        "rule.no-raw-color",
        "rule.contrast-aa",
        "rule.agent-traceability"
      ],
      "slots": [
        {
          "id": "positioning",
          "role": "content",
          "required": true,
          "instruction": "Lead with one differentiated outcome in plain language."
        },
        {
          "id": "product-evidence",
          "role": "evidence",
          "required": true,
          "instruction": "Pair the promise with a concrete product or governance proof."
        },
        {
          "id": "primary-action",
          "role": "control",
          "required": true,
          "instruction": "Use one explicit primary conversion action."
        }
      ],
      "agent": {
        "requiredInputs": ["audience", "positioning", "primaryAction"],
        "requiredTraceFields": [
          "designSystemVersion",
          "brandVersionId",
          "channel",
          "theme",
          "policyStatus",
          "tokens",
          "components",
          "assets",
          "patterns",
          "unresolvedDecisions",
          "claims",
          "primaryAction"
        ],
        "humanReviewTriggers": [
          "Unverified claim",
          "New logo treatment",
          "New conversion or legal copy"
        ]
      },
      "usage": {
        "do": [
          "Balance editorial display type with product-grade evidence.",
          "Keep the signal rail to one intentional appearance."
        ],
        "dont": [
          "Stack interchangeable marketing cards.",
          "Use generic gradients as brand expression."
        ]
      }
    },
    {
      "id": "pattern.campaign.signal-creative",